{
  "schema_version": "process-governance-v3",
  "export_meta": {
    "package_ref": "package_review_readiness_approval_parallel_20260813",
    "exported_at": "2026-08-13T00:00:00.000Z",
    "initiating_department": "行政人事部",
    "compiler": "流程评审准备测试样例"
  },
  "process": {
    "process_ref": "process_review_readiness_approval_parallel",
    "process_name": "审批退回与并行流程评审准备测试样例",
    "owning_department": "行政人事部",
    "purpose": "验证判断分支、退回、并行开始、并行汇合和历史批准角色检查",
    "scope": "仅用于3001规则开发和回归测试，不代表公司现行流程或审核结论",
    "capability_domain": null,
    "business_capability": null,
    "classification_status": "unclassified"
  },
  "reference_materials": [],
  "behaviors": [
    {
      "behavior_ref": "behavior_approval_submit",
      "node_type": "action",
      "behavior_name": "提交测试申请",
      "behavior_description": "测试申请人提交一项不含真实业务数据的申请。",
      "current_actor_role": "全公司",
      "actor_assignment_mode": "company_wide",
      "actor_department_data_ref": null,
      "actor_position_rule": "",
      "trigger": "测试申请人需要验证审批、退回和并行结构时",
      "precondition": "",
      "input_description": "",
      "timing": null,
      "completion_standard": "测试申请已经提交",
      "output_description": "",
      "input_data_refs": [],
      "output_data_refs": [],
      "work_role": null,
      "countersign_all_required": false,
      "countersign_target_departments": []
    },
    {
      "behavior_ref": "behavior_approval_review",
      "node_type": "decision",
      "behavior_name": "审核测试申请",
      "behavior_description": "主管核对测试申请，形成通过或退回补充结论。",
      "current_actor_role": "行政人事部 主管",
      "actor_assignment_mode": "fixed_department",
      "actor_department_data_ref": null,
      "actor_position_rule": "",
      "trigger": "",
      "precondition": "",
      "input_description": "",
      "timing": null,
      "completion_standard": "形成通过或退回补充结论",
      "output_description": "",
      "input_data_refs": [],
      "output_data_refs": [],
      "work_role": {
        "behavior_ref": "behavior_approval_review",
        "work_role_code": null,
        "role_duty": "审核",
        "work_role_name": "审核测试申请行为的审核角色",
        "assignment_status": "pending_assignment"
      },
      "countersign_all_required": false,
      "countersign_target_departments": []
    },
    {
      "behavior_ref": "behavior_approval_parallel_split",
      "node_type": "parallel_split",
      "behavior_name": "同时启动两项核对",
      "behavior_description": "控制节点同时启动两条测试核对路线。",
      "current_actor_role": "行政人事部 主管",
      "actor_assignment_mode": "fixed_department",
      "actor_department_data_ref": null,
      "actor_position_rule": "",
      "trigger": "",
      "precondition": "",
      "input_description": "",
      "timing": null,
      "completion_standard": "",
      "output_description": "",
      "input_data_refs": [],
      "output_data_refs": [],
      "work_role": null,
      "countersign_all_required": false,
      "countersign_target_departments": []
    },
    {
      "behavior_ref": "behavior_approval_check_a",
      "node_type": "action",
      "behavior_name": "执行第一项核对",
      "behavior_description": "主管核对测试条件A。",
      "current_actor_role": "行政人事部 主管",
      "actor_assignment_mode": "fixed_department",
      "actor_department_data_ref": null,
      "actor_position_rule": "",
      "trigger": "",
      "precondition": "",
      "input_description": "",
      "timing": null,
      "completion_standard": "测试条件A已经核对",
      "output_description": "",
      "input_data_refs": [],
      "output_data_refs": [],
      "work_role": null,
      "countersign_all_required": false,
      "countersign_target_departments": []
    },
    {
      "behavior_ref": "behavior_approval_check_b",
      "node_type": "action",
      "behavior_name": "执行第二项核对",
      "behavior_description": "主管核对测试条件B。",
      "current_actor_role": "行政人事部 主管",
      "actor_assignment_mode": "fixed_department",
      "actor_department_data_ref": null,
      "actor_position_rule": "",
      "trigger": "",
      "precondition": "",
      "input_description": "",
      "timing": null,
      "completion_standard": "测试条件B已经核对",
      "output_description": "",
      "input_data_refs": [],
      "output_data_refs": [],
      "work_role": null,
      "countersign_all_required": false,
      "countersign_target_departments": []
    },
    {
      "behavior_ref": "behavior_approval_parallel_join",
      "node_type": "parallel_join",
      "behavior_name": "等待两项核对完成",
      "behavior_description": "控制节点等待两条测试路线全部完成。",
      "current_actor_role": "行政人事部 主管",
      "actor_assignment_mode": "fixed_department",
      "actor_department_data_ref": null,
      "actor_position_rule": "",
      "trigger": "",
      "precondition": "",
      "input_description": "",
      "timing": null,
      "completion_standard": "",
      "output_description": "",
      "input_data_refs": [],
      "output_data_refs": [],
      "work_role": null,
      "countersign_all_required": false,
      "countersign_target_departments": []
    },
    {
      "behavior_ref": "behavior_approval_approve",
      "node_type": "action",
      "behavior_name": "批准测试申请",
      "behavior_description": "主管在两项测试核对完成后批准测试申请。",
      "current_actor_role": "行政人事部 主管",
      "actor_assignment_mode": "fixed_department",
      "actor_department_data_ref": null,
      "actor_position_rule": "",
      "trigger": "",
      "precondition": "",
      "input_description": "",
      "timing": null,
      "completion_standard": "批准结论已经记录",
      "output_description": "",
      "input_data_refs": [],
      "output_data_refs": [],
      "work_role": {
        "behavior_ref": "behavior_approval_approve",
        "work_role_code": null,
        "role_duty": "批准",
        "work_role_name": "批准测试申请行为的批准角色",
        "assignment_status": "pending_assignment"
      },
      "countersign_all_required": false,
      "countersign_target_departments": []
    },
    {
      "behavior_ref": "behavior_approval_close",
      "node_type": "action",
      "behavior_name": "结束测试流程",
      "behavior_description": "主管记录本次结构测试已经结束。",
      "current_actor_role": "行政人事部 主管",
      "actor_assignment_mode": "fixed_department",
      "actor_department_data_ref": null,
      "actor_position_rule": "",
      "trigger": "",
      "precondition": "",
      "input_description": "",
      "timing": null,
      "completion_standard": "测试结果已经记录，流程结束",
      "output_description": "",
      "input_data_refs": [],
      "output_data_refs": [],
      "work_role": null,
      "countersign_all_required": false,
      "countersign_target_departments": []
    }
  ],
  "flow_relations": [
    {
      "relation_ref": "relation_approval_01",
      "relation_type": "sequence",
      "from_behavior_ref": "behavior_approval_submit",
      "to_behavior_ref": "behavior_approval_review",
      "condition": "",
      "join_mode": ""
    },
    {
      "relation_ref": "relation_approval_02",
      "relation_type": "condition",
      "from_behavior_ref": "behavior_approval_review",
      "to_behavior_ref": "behavior_approval_parallel_split",
      "condition": "通过",
      "join_mode": ""
    },
    {
      "relation_ref": "relation_approval_03",
      "relation_type": "loop",
      "from_behavior_ref": "behavior_approval_review",
      "to_behavior_ref": "behavior_approval_submit",
      "condition": "退回补充",
      "join_mode": ""
    },
    {
      "relation_ref": "relation_approval_04",
      "relation_type": "parallel",
      "from_behavior_ref": "behavior_approval_parallel_split",
      "to_behavior_ref": "behavior_approval_check_a",
      "condition": "",
      "join_mode": ""
    },
    {
      "relation_ref": "relation_approval_05",
      "relation_type": "parallel",
      "from_behavior_ref": "behavior_approval_parallel_split",
      "to_behavior_ref": "behavior_approval_check_b",
      "condition": "",
      "join_mode": ""
    },
    {
      "relation_ref": "relation_approval_06",
      "relation_type": "parallel",
      "from_behavior_ref": "behavior_approval_check_a",
      "to_behavior_ref": "behavior_approval_parallel_join",
      "condition": "",
      "join_mode": "all"
    },
    {
      "relation_ref": "relation_approval_07",
      "relation_type": "parallel",
      "from_behavior_ref": "behavior_approval_check_b",
      "to_behavior_ref": "behavior_approval_parallel_join",
      "condition": "",
      "join_mode": "all"
    },
    {
      "relation_ref": "relation_approval_08",
      "relation_type": "sequence",
      "from_behavior_ref": "behavior_approval_parallel_join",
      "to_behavior_ref": "behavior_approval_approve",
      "condition": "",
      "join_mode": ""
    },
    {
      "relation_ref": "relation_approval_09",
      "relation_type": "sequence",
      "from_behavior_ref": "behavior_approval_approve",
      "to_behavior_ref": "behavior_approval_close",
      "condition": "",
      "join_mode": ""
    }
  ],
  "data_objects": [],
  "cross_department_handoffs": [],
  "internal_process_calls": [],
  "forms": [],
  "terms": []
}
